{
  "concepts": [
    {
      "classification": "executable",
      "kind": "state",
      "name": "x"
    }
  ],
  "domain": "d",
  "domainSemanticsHash": "917d3f199d178b5f263ba8a925857da0e5ecf4f3a87351f36671640973242826",
  "failureModes": [],
  "implements": "coordinate.c",
  "imports": [],
  "invariants": [],
  "kind": "neutrino.l2-domain-semantics",
  "l1Features": [
    {
      "kind": "primitive",
      "name": "effect:debit"
    }
  ],
  "provenance": [
    {
      "source": "s",
      "status": "accepted",
      "subject": "r"
    }
  ],
  "reductions": [
    {
      "from": "x",
      "id": "r",
      "lossiness": "lossless",
      "relation": "expands",
      "to": "effect:debit"
    }
  ],
  "schemaVersion": 2,
  "version": "1.0.0"
}
