{
  "concepts": [
    {
      "classification": "executable",
      "kind": "state",
      "name": "x"
    }
  ],
  "domain": "d",
  "domainSemanticsHash": "1f2c39c4c4940636747a43a07374bcf9659689d1217bd235eea4a0383fcfd43a",
  "failureModes": [],
  "implements": "coordinate.b",
  "imports": [
    {
      "capability": "coordinate.c",
      "version": "1.0.0"
    }
  ],
  "invariants": [],
  "kind": "neutrino.l2-domain-semantics",
  "l1Features": [
    {
      "kind": "primitive",
      "name": "effect:debit"
    }
  ],
  "provenance": [
    {
      "source": "s",
      "status": "accepted",
      "subject": "r"
    }
  ],
  "reductions": [
    {
      "from": "x",
      "id": "r",
      "lossiness": "lossless",
      "relation": "expands",
      "to": "effect:debit"
    }
  ],
  "schemaVersion": 2,
  "version": "1.0.0"
}
